{
  "description": "Creates a restricted key with a monthly spend limit.",
  "operationId": "createApiKey",
  "call": {
    "params": {
      "name": "CI smoke tests",
      "access": "restricted",
      "permissions": {
        "tts": "write",
        "voices": "read",
        "account": "read"
      },
      "monthly_spend_limit": 5000
    }
  },
  "request": {
    "method": "POST",
    "path": "/api-keys",
    "headers": {
      "authorization": "Bearer nai_test_fixture_key",
      "content-type": "application/json"
    },
    "body": {
      "json": {
        "name": "CI smoke tests",
        "access": "restricted",
        "permissions": {
          "tts": "write",
          "voices": "read",
          "account": "read"
        },
        "monthly_spend_limit": 5000
      }
    }
  },
  "response": {
    "status": 201,
    "headers": {
      "content-type": "application/json",
      "cache-control": "no-store",
      "x-request-id": "00000000-0000-4000-8000-000000000027"
    },
    "body": {
      "json": {
        "data": {
          "id": "01j9zqb2c3d4e5f6g7h8j9k0m1",
          "name": "CI smoke tests",
          "description": null,
          "masked_key": "nai_****m1Qa",
          "access": "restricted",
          "permissions": {
            "tts": "write",
            "voices": "read",
            "stt": "none",
            "llm": "none",
            "embeddings": "none",
            "rerank": "none",
            "account": "read",
            "api_keys": "none"
          },
          "expires_at": null,
          "allowed_ips": [],
          "monthly_spend_limit": 5000,
          "spent_this_month": 0,
          "enabled": true,
          "revoked_at": null,
          "last_used_at": null,
          "created_at": "2026-09-28T10:05:00Z",
          "secret": "nai_fixture_secret_shown_once"
        },
        "request_id": "00000000-0000-4000-8000-000000000027"
      }
    }
  },
  "result": {
    "data": {
      "id": "01j9zqb2c3d4e5f6g7h8j9k0m1",
      "name": "CI smoke tests",
      "description": null,
      "masked_key": "nai_****m1Qa",
      "access": "restricted",
      "permissions": {
        "tts": "write",
        "voices": "read",
        "stt": "none",
        "llm": "none",
        "embeddings": "none",
        "rerank": "none",
        "account": "read",
        "api_keys": "none"
      },
      "expires_at": null,
      "allowed_ips": [],
      "monthly_spend_limit": 5000,
      "spent_this_month": 0,
      "enabled": true,
      "revoked_at": null,
      "last_used_at": null,
      "created_at": "2026-09-28T10:05:00Z",
      "secret": "nai_fixture_secret_shown_once"
    },
    "request_id": "00000000-0000-4000-8000-000000000027"
  }
}
