{
  "description": "Gets one API key by id.",
  "operationId": "retrieveApiKey",
  "call": {
    "path_params": {
      "id": "01j9zqa1b2c3d4e5f6g7h8j9k0"
    }
  },
  "request": {
    "method": "GET",
    "path": "/api-keys/01j9zqa1b2c3d4e5f6g7h8j9k0",
    "headers": {
      "authorization": "Bearer nai_test_fixture_key"
    },
    "body": null
  },
  "response": {
    "status": 200,
    "headers": {
      "content-type": "application/json",
      "x-request-id": "00000000-0000-4000-8000-000000000028"
    },
    "body": {
      "json": {
        "data": {
          "id": "01j9zqa1b2c3d4e5f6g7h8j9k0",
          "name": "Production",
          "description": null,
          "masked_key": "nai_****k0Zx",
          "access": "full",
          "permissions": {
            "tts": "write",
            "voices": "write",
            "stt": "write",
            "llm": "write",
            "embeddings": "write",
            "rerank": "write",
            "account": "read",
            "api_keys": "none"
          },
          "expires_at": null,
          "allowed_ips": [],
          "monthly_spend_limit": null,
          "spent_this_month": 1200.5,
          "enabled": true,
          "revoked_at": null,
          "last_used_at": "2026-09-28T09:59:00Z",
          "created_at": "2026-09-01T12:00:00Z"
        },
        "request_id": "00000000-0000-4000-8000-000000000028"
      }
    }
  },
  "result": {
    "data": {
      "id": "01j9zqa1b2c3d4e5f6g7h8j9k0",
      "name": "Production",
      "description": null,
      "masked_key": "nai_****k0Zx",
      "access": "full",
      "permissions": {
        "tts": "write",
        "voices": "write",
        "stt": "write",
        "llm": "write",
        "embeddings": "write",
        "rerank": "write",
        "account": "read",
        "api_keys": "none"
      },
      "expires_at": null,
      "allowed_ips": [],
      "monthly_spend_limit": null,
      "spent_this_month": 1200.5,
      "enabled": true,
      "revoked_at": null,
      "last_used_at": "2026-09-28T09:59:00Z",
      "created_at": "2026-09-01T12:00:00Z"
    },
    "request_id": "00000000-0000-4000-8000-000000000028"
  }
}
