{
  "description": "Clones a voice from a sample; the upload is multipart.",
  "operationId": "createVoice",
  "call": {
    "params": {
      "name": "Office voice",
      "language": "uz",
      "ref_text": "Salom, men sizga yordam beraman.",
      "category": "conversational",
      "tags": [
        "support"
      ]
    },
    "files": {
      "ref_audio": {
        "filename": "sample.wav",
        "content_type": "audio/wav",
        "base64": "UklGRiQAAABXQVZFZm10IBAAAAABAAEAgD4AAAB9AAACABAAZGF0YQAAAAA="
      }
    },
    "options": {
      "idempotency_key": "fx-voice-1"
    }
  },
  "request": {
    "method": "POST",
    "path": "/tts/voices",
    "headers": {
      "authorization": "Bearer nai_test_fixture_key",
      "content-type": "multipart/form-data",
      "idempotency-key": "fx-voice-1"
    },
    "body": {
      "multipart": {
        "fields": {
          "name": "Office voice",
          "language": "uz",
          "ref_text": "Salom, men sizga yordam beraman.",
          "category": "conversational",
          "tags": [
            "support"
          ]
        },
        "files": {
          "ref_audio": {
            "filename": "sample.wav",
            "content_type": "audio/wav",
            "base64": "UklGRiQAAABXQVZFZm10IBAAAAABAAEAgD4AAAB9AAACABAAZGF0YQAAAAA="
          }
        }
      }
    }
  },
  "response": {
    "status": 201,
    "headers": {
      "content-type": "application/json",
      "x-request-id": "00000000-0000-4000-8000-000000000014"
    },
    "body": {
      "json": {
        "data": {
          "id": "01j9zq8m4r2k5t7w9y1b3d5f7h",
          "name": "Office voice",
          "language": "uz",
          "tags": [
            "support"
          ],
          "type": "custom",
          "category": "conversational",
          "ref_text": "Salom, men sizga yordam beraman.",
          "created_at": "2026-09-20T08:30:00Z"
        },
        "request_id": "00000000-0000-4000-8000-000000000014"
      }
    }
  },
  "result": {
    "data": {
      "id": "01j9zq8m4r2k5t7w9y1b3d5f7h",
      "name": "Office voice",
      "language": "uz",
      "tags": [
        "support"
      ],
      "type": "custom",
      "category": "conversational",
      "ref_text": "Salom, men sizga yordam beraman.",
      "created_at": "2026-09-20T08:30:00Z"
    },
    "request_id": "00000000-0000-4000-8000-000000000014"
  }
}
